Sr_No,Date,Startup_Name,Industry_Vertical,SubVertical,City,Investors_Name,InvestmentnType,Amount_in_USD,Remarks,
663,22/08/2017,EasyGov,Consumer Internet,Govt service application portal,Noida,"Social Alpha, Rajan Anandan, Rajeev Ahuja, Kshitij Arora",Seed Funding,N/A,nan,
664,23/08/2017,Milk Basket,Consumer Internet,Online Grocery platform,Gurgaon,Blume Ventures. Lenovo Capital and Incubator Group (LCIG),Seed Funding,N/A,nan,
670,25/08/2017,Ink Monk,Consumer Internet,Online printing marketplace,Chennai,"VAMM Ventures, Raksul, Dena",Seed Funding,"7,50,000",nan,
671,25/08/2017,Medinfi,Consumer Internet,Online Doctor Discovery Platform,Bangalore,"PBS Srinivas, Vinod Martin,",Seed Funding,"1,25,000",nan,
673,29/08/2017,CureFit,Consumer Internet,End to End health and wellness platform.,Bangalore,"Accel Partners, IDG Ventures, Kalaari Capital,\xc2\xa0 UC-RNT fund",Private Equity,"2,50,00,000",nan,
676,30/08/2017,Treebo,Consumer Internet,Budget Hotel Aggregator platform,Bangalore,"Ward Ferry Management and Karst Peak Capital,",Private Equity,"3,40,00,000",nan,
678,01/07/2017,Billion Loans,Consumer Internet,Peer to Peer Lending platform,Bangalore,Reliance Corporate Advisory Services Ltd,Seed Funding,"10,00,000",nan,
683,05/07/2017,Timesaverz,Consumer Internet,Hyperlocal home services provider,Mumbai,BCCL,Private Equity,"10,00,000",nan,
685,06/07/2017,MyCity4kids,Consumer Internet,parenting blog and kids\\xe2\\x80\\x99 events discovery platform,Gurgaon,N/A,Seed Funding,N/A,nan,
686,07/07/2017,Clip App,Consumer Internet,Digital Media Video platform,Bangalore,"India Quotient, Shunwei Capital",Seed Funding,"10,00,000",nan,
687,07/07/2017,Upwardly.in,Consumer Internet,MF investment platform,Bangalore,"Sreeram Iyer, Suvo Sarkar, Anita Gupta, Likemind Ventures",Seed Funding,N/A,nan,
689,11/07/2017,Fabogo,Consumer Internet,Salon & Spa Aggregation & Discovery platform,Pune,Dunamis Ventures Pte Ltd,Private Equity,"22,50,000",nan,
690,11/07/2017,Flickstree,Consumer Internet,Video Content Discovery Platform,Mumbai,"Venture Catalysts, Sourav Ganguly, Ankit Aditya, Moksh Sports Ventures",Seed Funding,"4,64,000",nan,
691,11/07/2017,Design Cafe,Consumer Internet,Online Interior Design platform,Bangalore,"Fireside Ventures, Apurva Salarpuria, Sidharth Pansari, Sprout Capital",Seed Funding,N/A,nan,
701,18/07/2017,Ambee,Consumer Internet,Ambulance Aggregation Services,Hyderabad,"Uber Technologies Inc, Amaya Capital LLP",Seed Funding,N/A,nan,
702,18/07/2017,Ideal Insurance,Consumer Internet,Online Insurance platform,Kolkata,Xelpmoc,Seed Funding,N/A,nan,
704,19/07/2017,Rentomojo,Consumer Internet,Consumer Leasing Platform,Bangalore,"ain Capital Ventures, Renaud Laplanche",Private Equity,"1,00,00,000",nan,
705,19/07/2017,AirCTO,Consumer Internet,AI powered recruitment platform,Bangalore,Francesco Cara,Seed Funding,N/A,nan,
711,21/07/2017,MonkeyBox,Consumer Internet,Healthy Food Delivery Platform,Bangalore,"Blume Ventures, NB Ventures, Nspira",Seed Funding,N/A,nan,
712,25/07/2017,Noticeboard,Consumer Internet,Mobile-first Enterprise communication platform,Bangalore,"Stellaris Venture Partners,",Private Equity,"12,00,000",nan,
713,25/07/2017,Byju\\xe2\\x80\\x99s,Consumer Internet,Mobile Learning App,Bangalore,Tencent Holdings,Private Equity,"3,50,00,000",nan,
715,26/07/2017,Fab Hotels,Consumer Internet,Budget hotels brand & Aggregator Platform,New Delhi,Goldman Sachs,Private Equity,"2,50,00,000",nan,
716,26/07/2017,ThinkerBell,Consumer Internet,Assisted Learning Startup,Bangalore,"Indian Angel Network, Anand Mahindra",Seed Funding,"2,00,000",nan,
718,28/07/2017,Jhakaas,Consumer Internet,App-based Aggregator of Offline Businesses,Mumbai,Amen Dhyllon,Seed Funding,N/A,nan,
719,28/07/2017,BigStylist,Consumer Internet,Beauty Services Marketplace,Mumbai,Info Edge (India) Ltd,Private Equity,"12,50,000",nan,
720,28/07/2017,Gympik.com,Consumer Internet,online marketplace for discovering fitness centres,Bangalore,RoundGlass Partners,Seed Funding,N/A,nan,
723,05/06/2017,Goomo,Consumer Internet,Online Travel & Holiday Booking platform,Mumbai,Emerging India,Private Equity,"5,00,00,000",nan,
724,05/06/2017,MaxMyWealth,Consumer Internet,Online Wealth Management & Savings platform,Mumbai,"lockchain ecosystem Global Advisors, Horseferry",Private Equity,N/A,nan,
726,06/06/2017,Healthbuds,Consumer Internet,Healthcare Discovery & booking platform,Kolkata,"Arun Patodia, Bharat Kedia",Seed Funding,N/A,nan,
727,06/06/2017,Ftcash,Consumer Internet,Mobile Payments platform,Mumbai,"500 Startups, IvyCap Ventures",Private Equity,N/A,nan,
728,06/06/2017,BHIVE Workspace,Consumer Internet,co-working spaces,Bangalore,Blume Ventures,Private Equity,"12,00,000",nan,
729,06/06/2017,wayForward,Consumer Internet,Mobile app for Mental Health,New Delhi,"Harsh Mahajan, Farhan Naqvi, Sreepathy Viswanathan",Seed Funding,"10,00,000",nan,
730,06/06/2017,GyanDhan,Consumer Internet,Education Marketplace,New Delhi,Sundaram Finance Holdings,Private Equity,N/A,nan,
731,06/06/2017,Hungry Foal,Consumer Internet,For profit Social Venture,Gurgaon,SBI (Stand Up India Scheme),Private Equity,N/A,nan,
732,07/06/2017,ZipLoan,Consumer Internet,Online lending platform,New Delhi,WaterBridge Ventures,Seed Funding,"6,50,000",nan,
733,07/06/2017,GrowFitter,Consumer Internet,health and fitness discovery platform,Mumbai,SQue Capital,Seed Funding,"6,00,000",nan,
734,08/06/2017,Stratfit,Consumer Internet,Health coaching programs,Hyderabad,Bodhtree Consulting Limited,Seed Funding,"2,32,000",nan,
737,08/06/2017,Stockal,Consumer Internet,App-based Investment advisory Services,Bangalore,"Mohan Alexander, R. Natarajan, Vikrant Varshney, Amit Sinha",Seed Funding,"3,50,000",nan,
738,09/06/2017,Guidoo,Consumer Internet,Travel & adventure planning platform,Mumbai,"Pawan Borle, Nirmal Singh, Manish Prasad, Vineet Varma, Nick Haulkoury, Abhai S. Rao",Seed Funding,"3,00,000",nan,
739,09/06/2017,eSahai.in,Consumer Internet,ambulance aggregator and medical taxi provider,Hyderabad,"Dr Ramesh Ayyala, Satya Muthyala",Seed Funding,"2,50,000",nan,
740,12/06/2017,Loanmeet,Consumer Internet,Online peer-to-peer lending platform,Bangalore,"Cao Yibin, Huang Wei, Madhusudan E,",Seed Funding,N/A,nan,
741,12/06/2017,LendingKart,Consumer Internet,Online Lending platform,Ahmedabad,Yes Bank,Debt Funding,"78,00,000",nan,
744,12/06/2017,Vista Rooms,Consumer Internet,Online rooms aggregation platform,Mumbai,"Artha India Ventures, Singularity Holdings, Rajan Anandan, Girish Mathrubootham",Seed Funding,"7,76,000",nan,
745,12/06/2017,CoverFox,Consumer Internet,Online insurance brokerage platform,Mumbai,Transamerica,Private Equity,"1,50,00,000",nan,
749,14/06/2017,Ola,Consumer Internet,Cab Aggregation App,Bangalore,Tekne Capital Management LLC,Private Equity,"5,00,00,000",nan,
750,14/06/2017,Vanitycask,Consumer Internet,Beauty products discovery platform,Mumbai,RB Investments,Seed Funding,N/A,nan,
751,14/06/2017,MrNeeds,Consumer Internet,Micro Food Delivery platform,Noida,undisclosed investors,Seed Funding,"5,00,000",nan,
752,15/06/2017,MoneyTap,Consumer Internet,Money Lending platform,Bangalore,"Sequoia India, NEA, Prime Venture Partners",Private Equity,"1,23,00,000",nan,
754,16/06/2017,Fincash,Consumer Internet,Personal Finance platform,Mumbai,"Mohammed Khan, Sameer Narayan & Others",Seed Funding,"1,00,000",nan,
757,16/06/2017,EazyDiner,Consumer Internet,Online Restaurant Reservation Platform,Gurgaon,YouWeCan Ventures,Seed Funding,N/A,nan,
761,20/06/2017,ForeverShop,Consumer Internet,Mobile based ecommerce platform,Bangalore,91maker.com,Seed Funding,"3,00,000",nan,
762,20/06/2017,Insider.in,Consumer Internet,Events Ticketing platform,Mumbai,Paytm,Private Equity,"52,00,000",nan,
764,21/06/2017,Grow Fit,Consumer Internet,Health-Tech platform,Bangalore,"Manipal Education and Medical Group (MEMG), SAR Group, The Grover Trust",Private Equity,"45,00,000",nan,
767,21/06/2017,OneAssist,Consumer Internet,Credit card fraud protection,Mumbai,Sequoia Capital,Private Equity,N/A,nan,
769,22/06/2017,Kissht,Consumer Internet,Consumer Lending platform,Mumbai,"Endiya Partners, Ventureast",Private Equity,"20,00,000",nan,
770,22/06/2017,Explore Life traveling,Consumer Internet,Local homes booking platform,Bangalore,"Mekin Maheshwari, Bharat Vijay, Krish Seshadri, Amar Arsikere",Seed Funding,"5,00,000",nan,
771,23/06/2017,Loantap,Consumer Internet,Lending platform for salaried professionals,Mumbai,"Kae Capital, India Quotient, IFMR, and MAS Financial Services Ltd",Private Equity,"40,00,000",nan,
772,23/06/2017,Voxweb,Consumer Internet,Mobile based social networking platform,Mumbai,Undisclosed investors,Seed Funding,"10,00,000",nan,
775,26/06/2017,V Resorts,Consumer Internet,Holiday & Vacation resort aggregator,Noida,"Seedfund, RB International",Private Equity,"40,00,000",nan,
776,27/06/2017,Stashfin,Consumer Internet,Personal Finance App,New Delhi,"Snow Leopard Ventures, Alto Partners",Private Equity,"50,00,000",nan,
777,27/06/2017,Formcept,Consumer Internet,Unified Data Analysis platform,Bangalore,Gujarat Venture Finance Ltd,Private Equity,N/A,nan,
779,28/06/2017,FiTraQ,Consumer Internet,Fitness Centre Discovery Platform,New Delhi,"Aparup Sengupta, Devendra Reddy,",Seed Funding,N/A,nan,
780,28/06/2017,Rubique,Consumer Internet,Online Marketplace for financial products,Mumbai,"Kalaari Capital, Udayan Goyal",Private Equity,"30,00,000",nan,
781,28/06/2017,Niki.ai,Consumer Internet,AI Based Personal Assistant,Bangalore,"SAP.iO, Unilazer Ventures",Private Equity,"20,00,000",nan,
782,29/06/2017,Fitpass,Consumer Internet,Online Fitness Marketplace,New Delhi,"Abhinav Bindra, Gaurav Marya",Private Equity,"10,00,000",nan,
785,30/06/2017,UrbanClap,Consumer Internet,Mobile Services Marketplace,Gurgaon,"Vy Capital, SAIF Partners, Accel Partner, Bessemer Venture Partners",Private Equity,"2,10,00,000",nan,
786,01/05/2017,Ace2three,Consumer Internet,Online Rummy playing Website,Hyderabad,Clairvest Group,Private Equity,"7,37,00,000",nan,
790,02/05/2017,SMECorner,Consumer Internet,Online Platform for small business loans,Mumbai,Dutch government fund,Private Equity,N/A,nan,
791,02/05/2017,ZippServe,Consumer Internet,Real estate risk assessment platform,Bangalore,undisclosed investors,Seed Funding,"3,90,000",nan,
792,03/05/2017,Ola,Consumer Internet,Cab Aggregation App,Bangalore,"Falcon Edge Capital,\xc2\xa0 Capital Advisers",Private Equity,"10,45,00,000",nan,
794,04/05/2017,Healthians,Consumer Internet,Online Diagnostics and wellness platform,New Delhi,"Asuka Holdings, YouWeCan Ventures, Beenext, Beenos, M&S Partners",Private Equity,N/A,nan,
795,05/05/2017,HealthMir,Consumer Internet,AI-based health content platform,New Delhi,Nimit Panigrahi,Seed Funding,N/A,nan,
796,05/05/2017,Uactive,Consumer Internet,Health-based social networking & discovery App,Mumbai,Hinduja family,Seed Funding,N/A,nan,
797,05/05/2017,i-lend,Consumer Internet,Peer-to-peer lending platform,Hyderabad,50K Ventures,Seed Funding,N/A,nan,
799,05/05/2017,Balance App,Consumer Internet,Money Savings & Management App,Bangalore,Rainmatter,Seed Funding,"2,33,000",nan,
801,08/05/2017,Nightstay,Consumer Internet,Last minute hotel booking mobile app,New Delhi,"Indian Angels Network, LetsVenture",Seed Funding,N/A,nan,
811,10/05/2017,Vidooly,Consumer Internet,Video Intelligence platform,Noida,"Times Internet, GVFL",Private Equity,"14,00,000",nan,
813,10/05/2017,Fourth Ambit,Consumer Internet,Community Building platform,Bangalore,1Crowd,Seed Funding,"6,00,000",nan,
815,11/05/2017,Early Salary,Consumer Internet,Online lending platform,Pune,"DG Ventures India, Dewan Housing Finance Corp",Private Equity,"40,00,000",nan,
818,12/05/2017,Legal Raasta,Consumer Internet,Legal Services to SMEs & Individuals,New Delhi,Impanix Capital,Private Equity,"50,00,000",nan,
820,12/05/2017,Remit Guru,Consumer Internet,Digital money transfer platform,Mumbai,"Infibeam, CCavenue",Private Equity,"4,66,000",nan,
827,17/05/2017,Genie,Consumer Internet,hyperlocal delivery and logistics mobile app,Chennai,undisclosed investors,Seed Funding,"2,50,000",nan,
828,17/05/2017,Paysense,Consumer Internet,Online Lending platform,Mumbai,Jungle Ventures,Private Equity,"53,00,000",nan,
832,19/05/2017,EzCred,Consumer Internet,Consumer Lending Platform,Bangalore,"Dheeraj Pandey, Rajesh Yohannan, Akash Garg",Seed Funding,"10,00,000",nan,
836,22/05/2017,ZipGrid,Consumer Internet,"Cashless, paperless solutions for Housing societies",Mumbai,"JLL, 1Crowd",Seed Funding,"5,00,000",nan,
838,23/05/2017,Magicpin,Consumer Internet,Hyperlocal discovery platform,Gurgaon,"Lightspeed Venture Partners, Vy Capital,",Private Equity,"66,00,000",nan,
839,23/05/2017,The Print,Consumer Internet,News Portal,New Delhi,"Ratan Tata, Nandan Nilekani, Uday Kotak, Vijay Shekhar Sharma, Kiran Mazumdar-Shaw, Rajiv C Mody",Seed Funding,N/A,nan,
840,23/05/2017,Box8,Consumer Internet,Food Delivery Platform,Mumbai,Trifecta Capital,Private Equity,"10,00,000",nan,
841,24/05/2017,GenNext Students,Consumer Internet,Online Tutoring Services,Mumbai,Undisclosed Investors,Seed Funding,"5,80,000",nan,
843,26/05/2017,WhatsLoan,Consumer Internet,Online Lending mobile app,Bangalore,Lahiri Music\\xe2\\x80\\x99s family office,Seed Funding,N/A,nan,
844,29/05/2017,Cube Consumer Services,Consumer Internet,Finance management Mobile app,Mumbai,N/A,Seed Funding,N/A,nan,
845,29/05/2017,Nivesh,Consumer Internet,Online MF investment platform,Noida,"PV Sahad, Sandeep Shroff, Rahul Gupta",Seed Funding,N/A,nan,
849,30/05/2017,SimpliLend,Consumer Internet,Online lending platform,New Delhi,Undisclosed Investors,Seed Funding,N/A,nan,
850,30/05/2017,Supr Daily,Consumer Internet,Subscription based delivery platform,Mumbai,"Soma Capital, Great Oaks Ventures, 122 West Ventures",Private Equity,"15,00,000",nan,
851,30/05/2017,Swiggy,Consumer Internet,Online food delivery platform,Bangalore,"Nasper, Accel India, SAIF Partners, Bessemer Venture Partners, Harmony Partners, Norwest Venture Partners",Private Equity,"8,00,00,000",nan,
853,31/05/2017,Magicpin,Consumer Internet,Hyperlocal Discovery\\xc2\\xa0 & Rewards platform,Gurgaon,"Lightspeed India Partners, Waterbridge Ventures",Private Equity,"70,00,000",nan,
854,01/04/2017,Cashe,Consumer Internet,Online & Mobile based Lending platform,Mumbai,"Mathew Cyriac, Florintree Advisors,",Private Equity,"38,00,000",nan,
856,03/04/2017,TestBook,Consumer Internet,Online Test Preparation Platform,Mumbai,Matrix Partners India,Private Equity,N/A,nan,
859,03/04/2017,SmartCoin,Consumer Internet,Micro Lending platform,Bangalore,Unicorn India Ventures & Others,Private Equity,N/A,nan,
864,04/04/2017,Trukky,Consumer Internet,Online Truck Aggregator & Booking platform,Ahmedabad,"Keyur Joshi, Pavan Bakeri",Seed Funding,"5,00,000",nan,
865,04/04/2017,Konsult App,Consumer Internet,App based Doctor Consulting platform,New Delhi,"Koen Bouwers, Lomesh Agarwal, Jeroen Mensen, Pablo van den Bosch & Others",Seed Funding,"5,00,000",nan,
866,05/04/2017,Credit Sudhaar,Consumer Internet,Credit Score Improvement platform,Mumbai,"Deepak Kulkarni, Sandeep Pangal",Seed Funding,N/A,nan,
867,05/04/2017,Fingerlix,Consumer Internet,Food Delivery Platform,Mumbai,Zephyr Peacock India,Private Equity,"30,00,000",nan,
870,06/04/2017,Mech Mocha,Consumer Internet,Mobile gaming startup,Bangalore,"Accel Partners, Shunwei Capital",Private Equity,"50,00,000",nan,
871,07/04/2017,Startup Buddy,Consumer Internet,Startup Support Platform,Gurgaon,"YouWeCan Ventures,",Seed Funding,N/A,nan,
876,08/04/2017,FastFox,Consumer Internet,Online rental discovery platform,Gurgaon,"Lightspeed India Partners, Blume Ventures, CyberAgent Ventures, GrowX Ventures, IMJ Investment Partners",Private Equity,"46,00,000",nan,
878,10/04/2017,Capital Float,Consumer Internet,Online Lending Platform for SME,Bangalore,Mahindra and Mahindra Financial Services,Private Equity,"23,00,000",nan,
881,11/04/2017,Sports Flashes,Consumer Internet,Online Sports portal & Mobile app,New Delhi,"Sushil Kumar, Sandeep Singh",Seed Funding,N/A,nan,
884,12/04/2017,HackerEarth,Consumer Internet,Online Skill Assessment Platform,Bangalore,"DHI Group Inc, Prime Venture Partners, Beenext, Beenos, Digital Garage, BizReach",Private Equity,"45,00,000",nan,
886,12/04/2017,Tinmen,Consumer Internet,Food Delivery Platform,Hyderabad,"MAPE Advisory Group, R Ramaraj, Corvus Ventures",Seed Funding,N/A,nan,
887,12/04/2017,ScoutMyTrip,Consumer Internet,Online Travel planner,Mumbai,Z Nation Lab,Seed Funding,N/A,nan,
889,13/04/2017,WeAreHolidays,Consumer Internet,Travel Packages & Planner marketplace,Gurgaon,"Urrshila Kerkar,",Private Equity,"77,00,000",nan,
890,14/04/2017,Ola Cabs,Consumer Internet,Cab Aggregator App,Bangalore,SIMI Pacific Pte,Private Equity,"26,00,00,000",nan,
891,15/04/2017,Myly,Consumer Internet,Mobile App for Schools,Jaipur,mall Industries Development Bank of India (SIDBI),Seed Funding,"3,10,000",nan,
892,17/04/2017,CrediHealth,Consumer Internet,Online Medical Assistance platform,Gurgaon,"Tolaram Inc, Mountain Pine Capital",Private Equity,"15,00,000",nan,
896,17/04/2017,Be U Salons,Consumer Internet,Online Salon discovery & Booking Services,New Delhi,"Gaurav Kachru, Sundeep Singh Sahni, Jatin Aneja, Arun Malhotra",Seed Funding,"6,20,000",nan,
897,17/04/2017,Simulanis,Consumer Internet,eLearning & Skills Development plat,New Delhi,Village Capital,Seed Funding,N/A,nan,
898,17/04/2017,LendingKart,Consumer Internet,Lending platform for small businesses,Ahmedabad,Anicut Capital,Private Equity,"46,50,000",nan,
903,20/04/2017,HolaChef,Consumer Internet,Online Food Delivery,Mumbai,"SIDBI Venture Capital Ltd, Kalaari Capital",Private Equity,"30,00,000",nan,
905,21/04/2017,Video Ken,Consumer Internet,Video Based Collaborative Learning,Bangalore,"Ravi Garikipati, Surot Chatterjee, Ashish Agrawal, LG Chandrasekhar, Sashi Reddi",Seed Funding,"10,00,000",nan,
907,24/04/2017,Oyo Rooms,Consumer Internet,Branded Budget Hotels Aggregator,Gurgaon,"SoftBank Vision Fund, Lightspeed Venture Partners, Sequoia Capital India Advisors, Greenoaks Capital Partners",Private Equity,"25,00,00,000",nan,
908,24/04/2017,Toppr,Consumer Internet,Learning mobile app for students,Mumbai,WGG International,Private Equity,"32,00,000",nan,
910,25/04/2017,The Office Pass,Consumer Internet,CoWorking Spaces booking platform,Gurgaon,"Arun Tadanki, Aditya Verma",Seed Funding,"2,45,000",nan,
911,25/04/2017,UrbanClap,Consumer Internet,Mobile Services Marketplace,Gurgaon,Trifecta Capital,Private Equity,"31,00,000",nan,
912,26/04/2017,Awfis,Consumer Internet,Collaborative co-Working Spaces,Mumbai,Sequoia India,Private Equity,"2,00,00,000",nan,
913,26/04/2017,Myra,Consumer Internet,Online Pharmacy,Bangalore,"Times Internet,Matrix Partners",Private Equity,N/A,nan,
915,26/04/2017,Howdy Ventures,Consumer Internet,Public and Private Events creation app,Chennai,S. Xavier Britto,Seed Funding,"15,00,000",nan,
917,26/04/2017,ZipGo,Consumer Internet,Bus Pooling services platform,Bangalore,"Orios Ventures Partners, Team Builder Ventures, Omidyar Networks",Private Equity,N/A,nan,
918,27/04/2017,Scootsy,Consumer Internet,On-Demand Food Delivery,Mumbai,"Agnus Capital, Khattar Holdings",Private Equity,"36,00,000",nan,
921,27/04/2017,iNurture,Consumer Internet,Online Educational courses,Bangalore,BlackSoil Capital Pvt. Ltd,Private Equity,"15,00,000",nan,
922,28/04/2017,Sepalika,Consumer Internet,Healthcare related content platform,New Delhi,Accel Partners,Seed Funding,"7,50,000",nan,
923,28/04/2017,Mintwalk,Consumer Internet,Financial advisory mobile app,Mumbai,Poshika Financial Ecosystem,Seed Funding,N/A,nan,
924,29/04/2017,Qriyo,Consumer Internet,Tutor Discovery & Booking platform,Jaipur,NB Ventures,Private Equity,N/A,nan,
925,01/03/2017,Ola,Consumer Internet,App based cab aggregator,Bangalore,SoftBank Group Corp,Private Equity,"33,00,00,000",nan,
926,01/03/2017,Belong,Consumer Internet,Online Jon Portal,Bangalore,Sequoia Capital India,Private Equity,"1,00,00,000",nan,
927,01/03/2017,Seenit,Consumer Internet,AI based Fashion Search Portal,Kolkata,"Calcutta Angels Network (CAN), Augment Ventures",Seed Funding,N/A,nan,
929,02/03/2017,Celes Care,Consumer Internet,Women Healthcare & Information portal,Hyderabad,"Ventureast, Endiya Partners, Eight Roads Ventures, F-Prime Capital Partners",Private Equity,"15,00,000",nan,
931,02/03/2017,Red Carpet,Consumer Internet,Micro Lending platform,Gurgaon,Lightspeed Venture Partners,Private Equity,"25,00,000",nan,
933,02/03/2017,CreditMantri,Consumer Internet,Online Credit score & lending platform,Chennai,Quona Capital,Private Equity,"76,00,000",nan,
934,03/03/2017,Lets Endorse,Consumer Internet,Online Ecosystem of social innovators,Bangalore,"Chandigarh Angels Network, Social Alpha and other unnamed angel investors",Seed Funding,N/A,nan,
936,03/03/2017,Nactus,Consumer Internet,Professional Tutors discovery & booking mobile app,Jaipur,"Sandeep Aggarwal, Gautam Chhaochharia, R Balachandar",Seed Funding,N/A,nan,
938,03/03/2017,Emojifi,Consumer Internet,Mobile App for live emoji,Hyderabad,Undisclosed angel investors,Seed Funding,N/A,nan,
941,06/03/2017,Juno Clinic,Consumer Internet,Online Counseling Platform,Mumbai,Atul Nishar,Seed Funding,"12,00,000",nan,
942,06/03/2017,Summerlabel,Consumer Internet,Fashion and Lifestyle discovery platform,Gurgaon,"Aneesh Seth, Tushar Mittal",Seed Funding,"1,50,000",nan,
943,06/03/2017,PickMe,Consumer Internet,Gadget Insurance & Repair Services platform,Mumbai,SIDBI Venture Capital Fund,Private Equity,"17,90,000",nan,
947,07/03/2017,Book Servicing,Consumer Internet,Online Vehicle Services Booking platform,New Delhi,National Science and Technology Entrepreneurship Development Board,Seed Funding,30000,nan,
948,07/03/2017,Blowhorn,Consumer Internet,Intra-City Logistics provider,Bangalore,"IDG Ventures India, Michael & Susan Dell Foundation, Draper Associates, Unitus Seed Fund",Private Equity,"36,50,000",nan,
951,08/03/2017,Supr Daily,Consumer Internet,Subscription based Home Delivery Platform,Mumbai,Y Combinator,Seed Funding,"1,20,000",nan,
952,08/03/2017,Parentune,Consumer Internet,Online Community for Parents,Gurgaon,"Kae Capital, SEGNEL Ventures",Private Equity,N/A,nan,
953,09/03/2017,AppBrowzer,Consumer Internet,Instant Mobile Apps Store,Bangalore,Deepak Gurnani,Seed Funding,"5,00,000",nan,
954,09/03/2017,MagicBricks,Consumer Internet,Online Real Estate Portal,Mumbai,Times Internet Ltd,Private Equity,"45,00,000",nan,
958,10/03/2017,PropertyShare,Consumer Internet,Fractional Proerty Ownership & Rental platform,Bangalore,"Asuka, Pravega Ventures, BEENEXT",Seed Funding,N/A,nan,
959,14/03/2017,MyDermacy,Consumer Internet,Online Dermatology consultation platform,New Delhi,Cyber Carrier,Private Equity,N/A,nan,
961,15/03/2017,Frapperz,Consumer Internet,On-demand home services provider,Kolkata,Undisclosed Investor,Seed Funding,"1,00,000",nan,
962,16/03/2017,mPaani,Consumer Internet,Loyalty rewards app,Mumbai,"IDG Ventures, Blume Ventures, Saha Fund,",Private Equity,"13,50,000",nan,
964,16/03/2017,POPxo,Consumer Internet,Digital Media publication for women,New Delhi,"GREE Ventures, Kalaari Capital and IDG Ventures India, Summit Media, Atul Goel, and Gurpreet Singh",Private Equity,"31,00,000",nan,
965,16/03/2017,Fitso,Consumer Internet,Fitness Mobile App,Gurgaon,"Sujeet Kumar, Bhupender Singh, Yashish Dhaiya",Seed Funding,"2,00,000",nan,
969,21/03/2017,MyGlamm,Consumer Internet,On-Demand Beauty Services,Mumbai,L\\xe2\\x80\\x99Occitane,Private Equity,"53,00,000",nan,
971,22/03/2017,Haqdarshak,Consumer Internet,Tech-Enabled Social Enterprise,Bangalore,"Ravi Saxena, Sandeep Raju,",Seed Funding,"1,91,000",nan,
972,23/03/2017,Ixigo,Consumer Internet,Online Travel Search Engine,Gurgaon,"Sequoia Capital, Kinzon Capital",Private Equity,"1,50,00,000",nan,
975,24/03/2017,BabyonBoard,Consumer Internet,Parenting Mobile App,Bangalore,"Mahavir Sharma, Vishal Jain, Rohit Sethi, Gaurav Luniya",Seed Funding,N/A,nan,
977,27/03/2017,Sport Flashes,Consumer Internet,Sports Based Online Media portal,New Delhi,"Vikas Bajaj, Amit Kharbanda,",Seed Funding,N/A,nan,
980,28/03/2017,DoneThing,Consumer Internet,On-demand Personal Assistant service,Gurgaon,Brand Capital,Private Equity,"3,00,000",nan,
982,29/03/2017,Ithaka,Consumer Internet,Vacation Trip Planning platform,Mumbai,"Ankit Gupta, Puneet Motihar",Seed Funding,"3,25,000",nan,
984,29/03/2017,Byju\\xe2\\x80\\x99s,Consumer Internet,Online Education Platform,Bangalore,Verlinvest,Private Equity,N/A,nan,
986,29/03/2017,Medinfi,Consumer Internet,Doctor & Hospital search Platform,Bangalore,"Vinod Martin, Hemant Kaul, Prof. Ram Kumar Kakani & Others",Seed Funding,50000,nan,
989,30/03/2017,Klinic App,Consumer Internet,Pathology & Diagnostic Tests Portal,Gurgaon,Om Chaudhry,Seed Funding,N/A,nan,
990,31/03/2017,Jhakaas,Consumer Internet,Offline Business Aggregator App,Mumbai,"Malini Patel, Stelcore Management Services, Anjani Prasad",Seed Funding,"1,55,000",nan,
993,31/03/2017,Rooter,Consumer Internet,Sports engagement platform,New Delhi,Intex Technologies,Private Equity,N/A,nan,
997,03/02/2017,Stockroom.io,Consumer Internet,Curated Platform for Developers,Hyderabad,"Satya D Sinha, Gyanendra Singh",Seed Funding,N/A,nan,
998,06/02/2017,Capital Float,Consumer Internet,Online lending platform,Bangalore,IFMR Capital Finance,Private Equity,"25,00,000",nan,
1000,07/02/2017,Inner Hour,Consumer Internet,Online Counselling Platform,Mumbai,"Batlivala & Karani Securities, Venture Works",Seed Funding,"4,50,000",nan,
1001,07/02/2017,Travel Triangle,Consumer Internet,Online travel agent marketplace,Noida,"RB Investments, SAIF Partners, Bessemer Venture Partners",Private Equity,"1,00,00,000",nan,
1002,08/02/2017,Wandertrails,Consumer Internet,"Online Travel, Adventure & Activities Portal",Bangalore,Earlsfield Capital,Seed Funding,"10,00,000",nan,
1004,08/02/2017,Cartrade,Consumer Internet,Automobile Classifieds Portal,Mumbai,Temasek Holdings,Private Equity,"5,50,00,000",nan,
