Sr_No,Date,Startup_Name,Industry_Vertical,SubVertical,City,Investors_Name,InvestmentnType,Amount_in_USD,Remarks,
1006,08/02/2017,Edurev,Consumer Internet,Online Education Portal,Gurgaon,Facebook FB Start programme,Seed Funding,40000,nan,
1011,10/02/2017,Redesyn,Consumer Internet,Tech Enabler for Artists,Mumbai,ThinQbate,Seed Funding,N/A,nan,
1014,13/02/2017,Wassup,Consumer Internet,On Demand Laundry & Dry Cleaning Services,Chennai,Anil Jain & other HNIs,Private Equity,"32,00,000",nan,
1015,13/02/2017,Better Mortgage,Consumer Internet,Mortgage Offering Platform,Gurgaon,"Kleiner Perkins, Goldman Sachs, Pine Brook",Private Equity,"1,50,00,000",nan,
1016,13/02/2017,Nurturey,Consumer Internet,Parenting Mobile App,New Delhi,Mohit Joshi & Others,Seed Funding,"3,30,000",nan,
1018,14/02/2017,GoBumpr,Consumer Internet,Online Bike & Car Services provider,Chennai,"Mahalingam K, Girish Mathrubootham",Seed Funding,"3,00,000",nan,
1019,14/02/2017,CCAvenue,Consumer Internet,Online Payment Gateway,Mumbai,Infibeam,Private Equity,"2,24,00,000",nan,
1021,15/02/2017,Innov8,Consumer Internet,Co-Working Space Platform,New Delhi,"Vijay Shekhar Sharma, Rajan Anandan, Kunal Shah, Girish Mathrubootham, Punit Soni, Anand Chandrasekaran, Sunil Kalra, Utsav Somani, Vishal Gondal, Vikram Limaye",Seed Funding,N/A,nan,
1022,15/02/2017,ZestMoney,Consumer Internet,Online Consumer Lending platform,Bangalore,"PayU, Ribbit Capital, Omidyar Network",Private Equity,"65,00,000",nan,
1024,16/02/2017,Truebil,Consumer Internet,Online Marketplace for Used Cars,Mumbai,Shunwei Capital,Private Equity,"30,00,000",nan,
1025,16/02/2017,YourStory,Consumer Internet,Online Media,Bangalore,"Kalaari Capital Partners, Qualcomm, 3ONE4 Capital Advisors, UC-RNT",Private Equity,"30,00,000",nan,
1027,17/02/2017,The Ken,Consumer Internet,Online Media Platform,Bangalore,"Aprameya Radhakrishna, Deepak Natraj, Girish Mathrubootham, Mahesh Murthy, Pallav Nadhani, Pavan Ongole, Sandeep Mathur, Vijay Shekhar Sharma & Others",Seed Funding,"4,00,000",nan,
1029,17/02/2017,Aisle,Consumer Internet,Online match-making app,Bangalore,"Konglo Ventures, White Unicorn Ventures, LetsVenture",Seed Funding,N/A,nan,
1030,17/02/2017,TownScript,Consumer Internet,DIY event registration and ticketing portal,Pune,BookMyShow,Private Equity,N/A,nan,
1032,18/02/2017,Blood n Care,Consumer Internet,First Aid care app,Gurgaon,Facebook FBStart,Seed Funding,40000,nan,
1034,21/02/2017,True Balance,Consumer Internet,Mobile balance Checking App,Gurgaon,"Softbank Ventures Korea, IMM Investment",Private Equity,"1,50,00,000",nan,
1035,22/02/2017,Vebbler,Consumer Internet,Photo Sharing for Groups,Bangalore,Facebook FBStart,Seed Funding,40000,nan,
1036,23/02/2017,Get My Parking,Consumer Internet,Smart Parking Platform,New Delhi,"Indian Angel Network (IAN), BEENEXT, The Chennai Angels, Sunil Munjal",Private Equity,"11,00,000",nan,
1037,23/02/2017,Lets Reap,Consumer Internet,B2B Mobile App for Pharmacies,Mumbai,"Kunal Shah, Sandeep Tandon, Nitin Saluja, Gagan Goyal",Seed Funding,N/A,nan,
1038,24/02/2017,Oglas,Consumer Internet,Mobile Advertising App,Noida,"Pankaj Rungta, Yogesh Agarwal",Seed Funding,N/A,nan,
1039,27/02/2017,Staydobe,Consumer Internet,Co-Living Spaces Aggregator,Bangalore,Ishan Manaktala,Seed Funding,N/A,nan,
1040,27/02/2017,Biryani By Kilo,Consumer Internet,Online Food Ordering & Delivery Portal,Gurgaon,"Chandigarh Angels, Ashish Gupta, Rohit, Ashish Chand, Sunil Singh & Others",Seed Funding,"3,75,000",nan,
1042,28/02/2017,NeoStencil,Consumer Internet,Live Online Coaching Classes,New Delhi,"Brand Capital, Paragon Trust",Private Equity,"10,00,000",nan,
1044,02/01/2017,TaxSutra,Consumer Internet,Online Tax Filing platform,Pune,"TV Mohandas Pai, V Balakrishnan, PV Srinivasan",Seed Funding,"3,66,000",nan,
1047,03/01/2017,Vow Car Clinic,Consumer Internet,Online/App Based Car cleaning service provider,Gurgaon,Vishal Malik,Seed Funding,N/A,nan,
1049,05/01/2017,MobiDent,Consumer Internet,Dentist Appointments booking platform,Bangalore,DanGold Investment Corp,Private Equity,N/A,nan,
1052,07/01/2017,FreeCharge,Consumer Internet,Mobile Wallet,Mumbai,Jasper Infotech Pvt Ltd,Private Equity,"5,70,00,000",nan,
1053,09/01/2017,TicketNew,Consumer Internet,Movie Ticket Booking platform,Chennai,Alibaba Pictures,Private Equity,"3,50,00,000",nan,
1056,10/01/2017,Loan Frame,Consumer Internet,Small Business Loans Marketplace platform,Gurgaon,"Vedanta Capital, William Campbell, Toos N Daruvala",Private Equity,"22,50,000",nan,
1057,10/01/2017,DriveSkool,Consumer Internet,online marketplace for driving schools,Bangalore,Aavya Ventures,Seed Funding,N/A,nan,
1058,10/01/2017,Medinfi,Consumer Internet,Doctor & Clinic Discovery portal,Bangalore,"Vinod Martin, Evan Lim, Kanchan Ghoshal, Ram Kumar Kakani",Seed Funding,"1,00,000",nan,
1060,11/01/2017,InstaOffice,Consumer Internet,CoWorking Spaces booking platform,Gurgaon,"Zishaan Hayath, Karan Chellani, Mohit Satyan",Seed Funding,N/A,nan,
1061,12/01/2017,Hansel.io,Consumer Internet,Real-time Mobile App Management Platform,Bangalore,"IDG Ventures, Endiya Partners",Private Equity,"13,50,000",nan,
1062,12/01/2017,Square Yards,Consumer Internet,Property Search Aggregator platform,Gurgaon,"Lohia Group, Andre Hoffman",Private Equity,"1,00,00,000",nan,
1064,13/01/2017,PaisaWapas,Consumer Internet,Cashback & Coupons platform,Bangalore,Vividhity Ventures,Seed Funding,N/A,nan,
1065,13/01/2017,iService,Consumer Internet,Gadgets Repair & Service Booking platform,Bangalore,"Blume Ventures, Girish Mathrubootham, Aprameya Radhakrishna",Seed Funding,"4,40,000",nan,
1066,14/01/2017,Unacademy,Consumer Internet,Online learning platform,Bangalore,"Nexus Venture Partners, Blume Ventures",Private Equity,"45,00,000",nan,
1068,16/01/2017,Leadburg,Consumer Internet,Personality Development Mobile App,Bangalore,"Harsh V. Pant, Ratheesh Raveendran",Seed Funding,N/A,nan,
1069,16/01/2017,ZoloStays,Consumer Internet,Branded PG Accomodation booking platform,Bangalore,"Nexus Venture Partners, Innoven Capital",Private Equity,"50,00,000",nan,
1071,16/01/2017,HipCouch,Consumer Internet,Custom & Modular Furniture platform,Mumbai,Undisclosed Investors,Seed Funding,"7,00,000",nan,
1072,17/01/2017,Curiositi,Consumer Internet,Online Learning Platform,Bangalore,"Menterra Social Impact Fund, Unitus Seed Fund",Private Equity,"8,00,000",nan,
1073,17/01/2017,TinyStep,Consumer Internet,Parenting Info & Social Network,Bangalore,Flipkart,Private Equity,"20,00,000",nan,
1074,17/01/2017,Practo,Consumer Internet,Online Healthcare platform,Bangalore,"Tencent,\xc2\xa0 ru-Net, RSI Fund, Thrive Capital",Private Equity,"5,50,00,000",nan,
1075,17/01/2017,Ketchupp,Consumer Internet,Food Discovery Platform,New Delhi,India Quotient and others,Seed Funding,"4,41,000",nan,
1076,17/01/2017,Hoopy,Consumer Internet,Online Car Service Platform,Gwalior,undisclosed investors,Seed Funding,"5,00,000",nan,
1077,17/01/2017,Ezytruk,Consumer Internet,Logistics and truck aggregator platform,Bangalore,"Ajith Nair, Anish K",Seed Funding,"1,47,000",nan,
1082,19/01/2017,PParke,Consumer Internet,Parking Solutions mobile app,Bangalore,SB Ventures,Seed Funding,N/A,nan,
1083,19/01/2017,Weddingz.in,Consumer Internet,Online Marketplace for Wedding Venues and vendors,Mumbai,Singularity Ventures,Private Equity,"10,00,000",nan,
1085,19/01/2017,Fitnapp,Consumer Internet,Fitness Mobile App,Noida,SD Group,Private Equity,N/A,nan,
1090,22/01/2017,MessaGif,Consumer Internet,social messaging platform,New Delhi,Undisclosed investor,Seed Funding,50000,nan,
1095,24/01/2017,SelectJobs,Consumer Internet,Online Job portal,Mumbai,India Educational Investment Fund,Seed Funding,N/A,nan,
1096,24/01/2017,Khel Now,Consumer Internet,Mobile-based Social Platform for Sports,Bangalore,Indochine International,Private Equity,"5,00,000",nan,
1097,24/01/2017,NowFloats,Consumer Internet,Platform to take businesses online,Hyderabad,"Iron Pillar and IIFL, Blume Ventures, Omidyar Network",Private Equity,"1,00,00,000",nan,
1098,24/01/2017,Lets Transport,Consumer Internet,Online transport vehicle booking platform,Bangalore,"GMO Japan, Neelesh Bhatnagar",Private Equity,"40,00,000",nan,
1100,25/01/2017,Wishberry,Consumer Internet,Crowdfunding Platform,Mumbai,"Sharad Sharma, Rajan Anandan,\xc2\xa0 Amit Ranjan, Alok Mittal & others",Seed Funding,N/A,nan,
1106,26/01/2017,AirMed Labs,Consumer Internet,Health Tests Booking platform & ePharmacy,Ahmedabad,Brand Capital,Private Equity,"14,00,000",nan,
1107,26/01/2017,99PerHour,Consumer Internet,Hyper-local Handyman Service provider,Chennai,V Aanand R,Seed Funding,"3,00,000",nan,
1108,26/01/2017,Kochi Post,Consumer Internet,English Online News portal,Kochi,"Rajesh Yohannan, Puthen & Cole",Seed Funding,N/A,nan,
1112,30/01/2017,Maptags,Consumer Internet,Smart Online address tags,Bangalore,The Ten Minute Million,Seed Funding,18000,nan,
1113,30/01/2017,YOLO Health,Consumer Internet,Online Healthcare platform,Mumbai,Chandigarh Angels Network (CAN),Seed Funding,N/A,nan,
1115,31/01/2017,Register My Marriage,Consumer Internet,Online Marriage Registration services,New Delhi,Mumbai Angels,Seed Funding,N/A,nan,
1117,01/12/2016,India Lends,Consumer Internet,Online Instant personal Loan provider,New Delhi,"DSG Consumer Partners, American Express Ventures, Cyber Carrier VC, AdvantEdge Partners",Private Equity,"40,00,000",nan,
1118,01/12/2016,Slide App,Consumer Internet,Lock screen Rewards mobile app,New Delhi,Songhyun Investment,Private Equity,"36,00,000",nan,
1119,02/12/2016,Badiyajobs,Consumer Internet,Entry-Level job Seekers platform,New Delhi,Undisclosed,Seed Funding,"1,00,000",nan,
1120,02/12/2016,Streo,Consumer Internet,Live Music Streaming App,Bangalore,"GEMs Advisory, Quarizon",Seed Funding,N/A,nan,
1122,05/12/2016,Mr Hot Foods,Consumer Internet,Online Food Ordering & Delivery Portal,Indore,IvyCamp Ventures,Seed Funding,N/A,nan,
1125,06/12/2016,Diro Labs,Consumer Internet,Mobile Contacts Management app,New Delhi,Info Edge (India),Seed Funding,"1,47,000",nan,
1127,07/12/2016,LookAtMe,Consumer Internet,Mobile App based Fashion Network,Singapore,Eros Labs,Seed Funding,N/A,nan,
1129,07/12/2016,BookEventz,Consumer Internet,"Venue, Events Booking platform",Mumbai,Investors from Mumbai Angels & LetsVenture,Seed Funding,N/A,nan,
1130,07/12/2016,Tailslife,Consumer Internet,Pet Parenting mobile app,Bangalore,"Mohan Kumar, V. Balakrishnan",Seed Funding,N/A,nan,
1131,07/12/2016,Revv,Consumer Internet,Self-Driven Car Services booking portal,New Delhi,Edelweiss Private Equity,Private Equity,"90,00,000",nan,
1132,07/12/2016,WealthApp,Consumer Internet,Online Investment Advisory platform,Bangalore,"Venk Krishnan, MJ Aravind, Vikram Kotak, Jayant Davar,\xc2\xa0 Ramkumar Nishtal, Arjun Sharmaa",Seed Funding,"4,40,000",nan,
1134,08/12/2016,Zest Money,Consumer Internet,Online Consumer Lending platform,Mumbai,PayU,Private Equity,"65,00,000",nan,
1135,08/12/2016,GoMechanic,Consumer Internet,Online Car servicing Booking platform,Gurgaon,Venture Catalysts,Seed Funding,"2,50,000",nan,
1141,12/12/2016,Rupaiya Exchange,Consumer Internet,P2P Lending platform,New Delhi,Undisclosed Investors,Seed Funding,"2,00,000",nan,
1142,12/12/2016,Doctor Insta,Consumer Internet,Online Doctor Consulting platform,Gurgaon,RoundGlass Partners,Private Equity,"20,00,000",nan,
1143,12/12/2016,UrbanPiper,Consumer Internet,Self-Branded Websites & Apps for Ecommerce,Bangalore,"Axilor, undisclosed investors",Seed Funding,N/A,nan,
1145,13/12/2016,Indifi,Consumer Internet,Online lending platform,Gurgaon,Omidyar Network,Private Equity,"1,00,00,000",nan,
1148,14/12/2016,Fitmein,Consumer Internet,Fitness Discovery & Booking platform,New Delhi,"FiNC, GHV",Seed Funding,N/A,nan,
1149,14/12/2016,Qacco,Consumer Internet,Hotel Booking platform,Gurgaon,"Lead Angels Network, Anbu Pandian, Prabhakar MR & Others",Seed Funding,"1,50,000",nan,
1150,14/12/2016,Fitpass,Consumer Internet,Fitness center aggregator & Booking mobile app,New Delhi,Mumbai Angels,Seed Funding,"10,00,000",nan,
1153,14/12/2016,Trading Bells,Consumer Internet,Online Share & Commodity Broking platform,Indore,Swastika Investmart Ltd,Seed Funding,"2,97,000",nan,
1154,15/12/2016,SERV\\xe2\\x80\\x99D,Consumer Internet,Financial Services For Unorganized Workforce,Pune,Digital Financial Service Lab,Seed Funding,"1,00,000",nan,
1159,16/12/2016,TripShelf,Consumer Internet,Holiday Packages provider,New Delhi,"GEMS Advisory, Quarizon",Seed Funding,"1,23,000",nan,
1160,19/12/2016,Events High,Consumer Internet,Events & Activities Marketplace,Bangalore,Axilor Ventures,Private Equity,N/A,nan,
1161,19/12/2016,NoBroker,Consumer Internet,Rental property search portal,Bangalore,"KTB Network, SAIF Partners, BEENEXT, Digital Garage",Private Equity,"74,00,000",nan,
1163,20/12/2016,Tiyo,Consumer Internet,Doctor Search Mobile App,Kolkata,Ajith Nair,Seed Funding,N/A,nan,
1164,20/12/2016,Zoomcar,Consumer Internet,Self-Driven Cab booking platform,Bangalore,Cyber Carrier CL,Private Equity,N/A,nan,
1165,20/12/2016,BYJU\\xe2\\x80\\x99s,Consumer Internet,Online Learning platform,Bangalore,International Financial Corporation,Private Equity,"1,50,00,000",nan,
1166,21/12/2016,Supr Daily,Consumer Internet,Daily Subscription based Delivery service,Mumbai,"Dr. Apoorv Ranjan Sharma, Anil Jain, Anuj Golecha, Krishna Jhunjhunwala, Anirudh Damani",Seed Funding,N/A,nan,
1167,21/12/2016,The BlueBook,Consumer Internet,online to offline marketing platform,Bangalore,"Indian Angel Network, Let\xe2\x80\x99s Venture",Seed Funding,"5,00,000",nan,
1171,22/12/2016,Mindler,Consumer Internet,Career Planning & Assessment platform,New Delhi,Taxmann,Seed Funding,"3,24,000",nan,
1175,23/12/2016,MyAdvo,Consumer Internet,Legal Advice Platform,New Delhi,"Pradyumna Dalmia, S. Somasegar & Others",Seed Funding,N/A,nan,
1177,23/12/2016,LexComply,Consumer Internet,Compliance Management Software,New Delhi,Ajay Relan,Seed Funding,N/A,nan,
1180,26/12/2016,Dekkho,Consumer Internet,Video Streaming platform,Mumbai,undisclosed investors,Seed Funding,"12,00,000",nan,
1183,28/12/2016,BookEventz,Consumer Internet,Online event-booking platform,Mumbai,"Lead Angels, Mumbai Angels, LetsVenture, Girish Mathrubootham, Anbu Pandian",Seed Funding,N/A,nan,
1184,29/12/2016,Healthifyme,Consumer Internet,Fitness Mobile App,Bangalore,NB Ventures,Private Equity,"10,00,000",nan,
1185,29/12/2016,LetsMD,Consumer Internet,Healthcare plan comparison platform,New Delhi,"WaterBridge Ventures,",Seed Funding,N/A,nan,
1186,29/12/2016,Justbooks,Consumer Internet,Library Chain Aggregator,Bangalore,CoCreate Ventures,Seed Funding,N/A,nan,
1187,30/12/2016,InstantPay,Consumer Internet,Digital payments & recharge platform,New Delhi,"RB Investments,\xc2\xa0 Kaleden Holdings",Private Equity,N/A,nan,
1188,01/11/2016,PickMyLaundry,Consumer Internet,On-Demand Washing & Dry Cleaning Services,New Delhi,"Kedar Lele, GHV Accelerator",Seed Funding,"2,00,000",nan,
1189,02/11/2016,FreshDesk,Consumer Internet,SAAS Based HelpDesk Services,Chennai,"Sequoia Capital India, Accel Partners",Private Equity,"5,50,00,000",nan,
1190,02/11/2016,LaundryAnna,Consumer Internet,On-Demand Washing & Dry Cleaning Services,Bangalore,Undisclosed Investors,Seed Funding,"1,50,000",nan,
1191,02/11/2016,LetsMD,Consumer Internet,Healthcare Services Comparison Platform,New Delhi,"Calcutta Angels Network, LetsVenture, Anupam Mittal, Currae Healthtech Fund",Seed Funding,N/A,nan,
1194,03/11/2016,DoSelect,Consumer Internet,Skill Showcasing platform,Bangalore,"3one4 Capital, Mumbai Angels, Aarin Capital",Seed Funding,N/A,nan,
1195,03/11/2016,EasyPolicy,Consumer Internet,Online insurance Portal,Noida,"Unilazer Ventures,",Private Equity,"1,00,00,000",nan,
1199,04/11/2016,vImmune,Consumer Internet,Immunisation Management Platform,Bangalore,Undisclosed investor,Seed Funding,N/A,nan,
1204,07/11/2016,JustRide,Consumer Internet,Online Car Sharing platform,Mumbai,"Justin Kan, Qasar Younis, Paul Bucche, Susa Ventures, Kima Ventures, Axan Venture, SCM Holdings",Private Equity,"30,00,000",nan,
1205,09/11/2016,IIM Jobs,Consumer Internet,Online Job Portal,New Delhi,India Quotient,Private Equity,"20,00,000",nan,
1206,09/11/2016,Square Yards,Consumer Internet,Online Property Search Portal,Gurgaon,ADAG Reliance Private Equity,Private Equity,"1,20,00,000",nan,
1207,10/11/2016,GolfLAN,Consumer Internet,Golf Session Online Bookings platform,New Delhi,"YourNest Angel Fund, iSON",Private Equity,"10,00,000",nan,
1210,11/11/2016,Life in Control,Consumer Internet,Online Diabetes Management platform,Gurgaon,RoundGlass Partners,Private Equity,N/A,nan,
1213,15/11/2016,NoBroker,Consumer Internet,Online Rental discovery,Bangalore,Vijay Shekhar Sharma,Seed Funding,N/A,nan,
1219,17/11/2016,Lawrato,Consumer Internet,Free Legal Advice,New Delhi,Indian Angel Network,Seed Funding,N/A,nan,
1220,17/11/2016,Trip Tap Toe,Consumer Internet,Online Travel Portal,Gurgaon,R.S Sharma,Seed Funding,N/A,nan,
1221,17/11/2016,Pictor Imaging,Consumer Internet,Product Photography Mobile App,Mumbai,Quarizon,Seed Funding,"1,47,000",nan,
1224,18/11/2016,WorkIndia,Consumer Internet,Job Board for Clue Collar Jobs,Mumbai,Asuka Holdings,Seed Funding,N/A,nan,
1225,21/11/2016,Bats on delivery,Consumer Internet,"Online food, Grocery ordering & Delivery",Gurgaon,Devdeep Singh,Seed Funding,90000,nan,
1227,22/11/2016,Housing.com,Consumer Internet,Real Estate Portal,Mumbai,Softbank Group,Private Equity,"50,00,000",nan,
1228,22/11/2016,Awesummly,Consumer Internet,Short News Mobile App,Bangalore,"Vivek Bhargava, Ameera Shah",Seed Funding,"1,47,000",nan,
1229,22/11/2016,VoLT,Consumer Internet,Ed-Tech Platform,Mumbai,YMS Mobitech,Seed Funding,N/A,nan,
1232,22/11/2016,Noddapp,Consumer Internet,App based networking platform,Mumbai,Undisclosed multiple investors,Seed Funding,"1,47,000",nan,
1233,23/11/2016,Knowlarity,Consumer Internet,Cloud Telephony Platform,Bangalore,"Delta Partners, Sequoia India,\xc2\xa0 Mayfield, Blacksoil, Trifecta Capital",Private Equity,"2,00,00,000",nan,
1236,24/11/2016,FroyoFit,Consumer Internet,Fitness Discovery Platform,Indore,Dr. Pooja Gandhi,Seed Funding,N/A,nan,
1237,24/11/2016,Betterplace,Consumer Internet,Background Verification Services,Bangalore,Venture Highway,Seed Funding,N/A,nan,
1238,24/11/2016,ShareChat,Consumer Internet,Local Language Social Networking Platform,Mumbai,"Lightspeed India Partners, SAIF Partners, India Quotient, Venture Highway",Private Equity,"40,00,000",nan,
1239,24/11/2016,UClean,Consumer Internet,Tech Enabled Laundry Service Provider,Gurgaon,Franchise India,Private Equity,N/A,nan,
1240,24/11/2016,Servify,Consumer Internet,Personal Device Assistant App,Mumbai,"Blume Ventures, BEENEXT, Barkawi Holdings GmbH, TM Service Technology Holdings Gmbh, Sreevathsa Prabhakar",Private Equity,N/A,nan,
1241,25/11/2016,Hubilo,Consumer Internet,End-to-end Event Organizers Solutions,Ahmedabad,"Girish Mathrubootham, VC Karthic, Miten Mehta, Umasankar Nistala, Rakesh Patel, Akash Bhavsar, Jeevanandhan Rajagopal, Vikas Chadha & Others",Seed Funding,N/A,nan,
1242,25/11/2016,FunOnGo,Consumer Internet,Digital Media Content and Distribution platform,Mumbai,Reliance Entertainment,Private Equity,N/A,nan,
1243,25/11/2016,121Policy,Consumer Internet,Online Insurance Platform,Kolkata,Xelpmoc,Seed Funding,N/A,nan,
1244,26/11/2016,TapChief,Consumer Internet,Professional Expert Advice Platform,Bangalore,"Paytm, Aprameya Radhakrishna, Subramanya Venkat, Venk Krishnan",Seed Funding,N/A,nan,
1245,28/11/2016,Kloseby,Consumer Internet,proximity based\\xc2\\xa0 Rewards platform,Bangalore,Undisclosed Investor,Seed Funding,"1,00,000",nan,
1247,29/11/2016,Crossahead,Consumer Internet,Creative Artists Discovery & Booking platform,Noida,Mohit Sharma,Seed Funding,N/A,nan,
1248,29/11/2016,Affordplan,Consumer Internet,Savings platform for Medical Expenses,New Delhi,"Prime Venture Partners, Kalaari Capital",Private Equity,"30,00,000",nan,
1249,30/11/2016,HandyTrain,Consumer Internet,Mobile App for SAAS based Training,Goa,"Silver Range Investments, Lumina Datamatics, Shun Yoshida & Others",Private Equity,"10,00,000",nan,
1256,30/11/2016,Math Buddy,Consumer Internet,Online Math Learn,Vadodara,Menterra Social Impact Fund,Seed Funding,"4,40,000",nan,
1257,30/11/2016,Pulse,Consumer Internet,Campus Social Networking App,Bangalore,SAIF Partners,Private Equity,"5,00,000",nan,
1258,30/11/2016,MonkeyBox,Consumer Internet,Healthy Food Delivery platform,Bangalore,Blume Ventures & Others,Seed Funding,N/A,nan,
1259,30/11/2016,Carcrew.in,Consumer Internet,Online Car repair Marketplace,Mumbai,TVS Group,Seed Funding,"5,00,000",nan,
1261,03/10/2016,Mystifly,Consumer Internet,Airline Ticket Aggregator,Bangalore,Recruit Holdings,Private Equity,"50,00,000",nan,
1262,03/10/2016,HelpChat,Consumer Internet,AI Powered Content & Commerce platform,Bangalore,"American Express Ventures, Sequoia Capital",Private Equity,N/A,nan,
1267,04/10/2016,GOQii,Consumer Internet,Health & Fitness Wearable Device,Mumbai,Ratan Tata,Private Equity,N/A,nan,
1270,04/10/2016,NetLinx,Consumer Internet,Internet Service Provider,Hyderabad,"Xchange Investors NV, TransGlobal FZC",Private Equity,"30,00,000",nan,
1271,04/10/2016,Scandid,Consumer Internet,Product Shopping Comparison App,Pune,3One4 Capital,Private Equity,N/A,nan,
1272,04/10/2016,Remitr,Consumer Internet,Foreign Currency Payments Platform,Mumbai,"Vijay Shekhar Sharma, Pravin Gandhi,\xc2\xa0 Smart Start Fund; Kunal Shah,\xc2\xa0 Sandeep Tandon, Vishal Gondal, & Others",Seed Funding,"10,00,000",nan,
1273,04/10/2016,InnerChef,Consumer Internet,Online food ordering platform,Gurgaon,"Mistletoe, M&S Partners",Private Equity,"25,00,000",nan,
1274,04/10/2016,AppsDaily,Consumer Internet,"Mobile Phone Theft, Damage Protection platform",Mumbai,"Zodius Capital, Kalaari Capital, Qualcomm Ventures, Russian venture capital fund Ru-Net, Mumbai Angels",Private Equity,"37,50,000",nan,
1275,05/10/2016,MuhurtMaza,Consumer Internet,Online Puja Booking Service,Pune,Undisclosed Investor,Seed Funding,N/A,nan,
1276,05/10/2016,Azuro,Consumer Internet,Rental Property Finder platform,Mumbai,"White Unicorn Ventures, Kae Capital, Mumbai Angels",Private Equity,N/A,nan,
1279,06/10/2016,FindmeaShoe,Consumer Internet,Footwear Recommendation App,Bangalore,Ventureast Fund Advisors,Seed Funding,N/A,nan,
1281,06/10/2016,Sportido,Consumer Internet,Sports Discovery platform,Noida,Sumpoorna Group,Seed Funding,N/A,nan,
1285,07/10/2016,Flexiloans,Consumer Internet,Online Funds Raising Platform,Mumbai,"Sanjay Nayar, Vikram Sud, Anil Jaggia, Narayan Seshadri",Private Equity,"1,50,00,000",nan,
1288,11/10/2016,Yupp TV,Consumer Internet,Internet-based TV streaming service provider,Bangalore,Emerald Media,Private Equity,"5,00,00,000",nan,
1289,11/10/2016,Deyor Camps,Consumer Internet,Branded Camping location Aggregator,Gurgaon,"Nitin Passi, Manickam Mahalingam, Udaan Angels, Rajesh Arora, Arkas Industries",Seed Funding,"5,00,000",nan,
1290,12/10/2016,ZipLoan,Consumer Internet,online lending platform,New Delhi,"GrowX Ventures, Sunil Kalra, Arun Venkatachalam,\xc2\xa0 Badal Malick",Seed Funding,N/A,nan,
1293,13/10/2016,Maya,Consumer Internet,Womens Health Tracker App,Bangalore,Rajan Anandan,Seed Funding,N/A,nan,
1295,14/10/2016,Newspatrolling,Consumer Internet,Online News portal,New Delhi,Undisclosed,Seed Funding,25000,nan,
1296,14/10/2016,Postman,Consumer Internet,API Platform,Bangalore,Nexus Venture Partners,Private Equity,"70,00,000",nan,
1299,14/10/2016,Kidsstoppress,Consumer Internet,Parenting and Baby care Platform,Mumbai,Karan Bhagat,Seed Funding,N/A,nan,
1300,14/10/2016,Innov8,Consumer Internet,Co-Working Spaces aggregator,Bangalore,Punit Soni,Seed Funding,N/A,nan,
1301,15/10/2016,DailyHunt,Consumer Internet,Vernacular content mobile app,Bangalore,"ByteDance, Arun Sarin, Matrix Partners, Sequoia Capital India, Omidyar Network,\xc2\xa0 Falcon Edge",Private Equity,"2,50,00,000",nan,
1302,15/10/2016,Tazzo Bikes,Consumer Internet,Motorbike rental platform,Hyderabad,DSG Consumer Partners,Seed Funding,"2,27,000",nan,
1303,15/10/2016,MyKindofJob,Consumer Internet,Internet & Fresher Job platform,Mumbai,"Mayank Shah, Shreyans Shah",Seed Funding,"10,00,000",nan,
1305,17/10/2016,Rooter,Consumer Internet,Sports Social Network mobile app,New Delhi,"Boman Irani, Dhruv Chitgopekar, Prantik Dasgupta",Seed Funding,N/A,nan,
1306,17/10/2016,Yumigo,Consumer Internet,App based Travel Discovery and Transactions platform,Gurgaon,Hemant Sahni,Seed Funding,"3,00,000",nan,
1309,18/10/2016,BabyChakra,Consumer Internet,Parenting and Child Care portal,Mumbai,RoundGlass Partners,Private Equity,N/A,nan,
1313,19/10/2016,Furlenco,Consumer Internet,Online Furniture Rental platform,Bangalore,"Lightbox Ventures, Axis Capital & Others",Private Equity,"3,00,00,000",nan,
1314,19/10/2016,Fisdom,Consumer Internet,Personal Wealth Management Platform & App,Bangalore,"Saama Capital, Raghunandan G, Aprameya Radhakrishna",Private Equity,"11,00,000",nan,
1316,20/10/2016,Stayology,Consumer Internet,Stay & Travel related services,Bangalore,Ranjan Pai,Seed Funding,N/A,nan,
1317,20/10/2016,Hipcask,Consumer Internet,Alcoholic beverage discovery platform,Mumbai,Mobikon,Seed Funding,N/A,nan,
1318,20/10/2016,RailYatri,Consumer Internet,Train Travel Info mobile app,Noida,"Helion Ventures, Blume ventures",Private Equity,N/A,nan,
1319,21/10/2016,ChatOnGo,Consumer Internet,Hyperlocal\\xc2\\xa0 Communication Mobile app,Mumbai,Janak Jain,Seed Funding,"3,00,000",nan,
1321,24/10/2016,Healthians,Consumer Internet,Health Test Discovery & Ordering service,Gurgaon,BEENEXT,Private Equity,"30,00,000",nan,
1322,24/10/2016,Box8,Consumer Internet,Online Food Ordering platform/App,Mumbai,"IIFL Seed Ventures Fund, Mayfield Ventures",Private Equity,"75,00,000",nan,
1324,25/10/2016,CreditMate,Consumer Internet,Credit Report Info platform,Mumbai,India Quotient,Seed Funding,"5,00,000",nan,
1328,26/10/2016,OrangeTwig,Consumer Internet,Social Media Marketing platform,New Delhi,Undisclosed investor,Seed Funding,"10,00,000",nan,
