Sr_No,Date,Startup_Name,Industry_Vertical,SubVertical,City,Investors_Name,InvestmentnType,Amount_in_USD,Remarks,
1682,05/05/2016,WebAlligator,Consumer Internet,Cloud Based Software Solutions,Bangalore,Group of undisclosed Angel Investors & HNIs,Seed Funding,"3,75,000",nan,
1687,09/05/2016,Toko Innovations,Consumer Internet,Children\\xe2\\x80\\x99s Entertainment Portal,Bangalore,"Roopak Saluja, Vishal Khare",Seed Funding,"4,50,000",nan,
1689,10/05/2016,HealthifyMe,Consumer Internet,Health & Fitness App,Bangalore,"IDG Ventures India, Inventus Capital, Blume Ventures",Private Equity,"60,00,000",nan,
1690,10/05/2016,Zarget,Consumer Internet,Conversion Rate Optimization Platform,Chennai,"Accel Partners, Matrix Partners, Girish Mathrubootham",Private Equity,"15,00,000",nan,
1693,10/05/2016,Swiggy,Consumer Internet,Food Delivery Platform,Bangalore,"Norwest Venture Partners, DST Global, Accel Partners",Private Equity,"70,00,000",nan,
1694,11/05/2016,Zenify,Consumer Internet,Home rental Discovery & Booking Portal,Bangalore,Undisclosed Investors,Private Equity,"9,00,000",nan,
1695,11/05/2016,Faircent,Consumer Internet,Online Peer to Peer Lending platform,Gurgaon,"JM Financial Products Ltd, Arun Tadanki, Doreswamy Nandkishore, Kshitij Jain",Private Equity,N/A,nan,
1697,12/05/2016,Unacademy,Consumer Internet,Free Online Education Platform,Bangalore,"Blume Ventures, Rajan Anandan, Sumit Jain, Aprameya Radhakrishna, Sujeet Kumar, Phanindra Sama",Seed Funding,"5,00,000",nan,
1698,12/05/2016,Capital Float,Consumer Internet,Online Lending Platform,Bangalore,"Creation Investments Capital Management, SAIF Partners, Sequoia Capital, Aspada Ventures",Private Equity,"2,50,00,000",nan,
1700,12/05/2016,Dream Wallets,Consumer Internet,Online Crowdfunding platform,Jaipur,"Rakesh Gupta, Aditya Aggarwal, Siddharth Banerjee, Vikas Ranjan, Anshul Jindal, Sunil Koul, and Sanjeev Agrawal",Seed Funding,N/A,nan,
1701,12/05/2016,ShabdNagari,Consumer Internet,Hindi social networking portal,Kanpur,ah! Ventures,Seed Funding,N/A,nan,
1702,12/05/2016,Galleri5,Consumer Internet,Visual Content Discovery platform,Bangalore,"Phanindra Sama, Raghunandan G,",Seed Funding,N/A,nan,
1704,13/05/2016,StayZilla,Consumer Internet,Budget Room Aggregator Booking platform,Chennai,"Matrix Partners, Nexus Ventures",Private Equity,"1,35,00,000",nan,
1707,16/05/2016,BedBathMore,Consumer Internet,Home Decor eMarketplace,Mumbai,"Kinnevik Group, Rocket Internet",Private Equity,N/A,nan,
1708,17/05/2016,Murgency,Consumer Internet,Medical Emergency Response App,Mumbai,Rata Tata,Private Equity,N/A,nan,
1709,17/05/2016,Crownit,Consumer Internet,Mobile customer rewards management platform,Gurgaon,"Undisclosed investors, Accel Partners, Helion Venture Partners",Private Equity,N/A,nan,
1711,18/05/2016,TheSmartQ,Consumer Internet,Food Ordering Mobile App,Bangalore,YourNest Angel Fund,Seed Funding,"2,50,000",nan,
1712,18/05/2016,PurpleHealth,Consumer Internet,Online health-on-demand platform,Trivandrum,Katabole Technology Venture,Seed Funding,"1,00,000",nan,
1716,18/05/2016,Parentlane,Consumer Internet,Parenting & Child Care app,Bangalore,"Sujeet Kumar, Aprameya, Sumit Jain, Subramanya Venkat, Venk, Ravi Machani, Hitesh Gupta, Rohit Choudhary",Seed Funding,N/A,nan,
1717,19/05/2016,Appie,Consumer Internet,Location-based offline retail discovery platform,Mumbai,Undisclosed investors,Seed Funding,"10,00,000",nan,
1719,19/05/2016,TaxiVaxi,Consumer Internet,Cab Aggregating Platform,New Delhi,Undisclosed HNIs,Seed Funding,"5,00,000",nan,
1720,19/05/2016,Veqta,Consumer Internet,On Demand Digital Sports Network,New Delhi,"Chatsworth Management, ITW Digital",Seed Funding,"5,00,000",nan,
1721,20/05/2016,i2ifunding,Consumer Internet,Online Peer to Peer Funding,Noida,Undisclosed Investors,Seed Funding,"3,00,000",nan,
1722,23/05/2016,EduRev,Consumer Internet,Online Learning Platform,Gurgaon,Pradeep Reddy Kamasan,Seed Funding,N/A,nan,
1723,23/05/2016,Hoppingo,Consumer Internet,Fashion Discovery platform,New Delhi,vCommission,Seed Funding,89000,nan,
1724,24/05/2016,Eatonomist,Consumer Internet,Food Delivery Platform,Gurgaon,MCube Capital Advisors Pvt Ltd,Seed Funding,N/A,nan,
1725,24/05/2016,Goalwise,Consumer Internet,Online investment platform,Bangalore,Undisclosed HNIs,Seed Funding,"10,00,000",nan,
1726,25/05/2016,Roast,Consumer Internet,Mobile entertainment App,New Delhi,Indian Angel Network,Seed Funding,N/A,nan,
1729,25/05/2016,SheThePeople,Consumer Internet,Digital platform for Women,New Delhi,Anand Mahindra,Seed Funding,N/A,nan,
1730,26/05/2016,Cleartax,Consumer Internet,Online Income Tax Filing platform,Bangalore,"FF Angel, Sequoia Capital",Private Equity,"20,00,000",nan,
1732,26/05/2016,mChamp,Consumer Internet,Celebrity Entertainment Contest App,New Delhi,MoMagic Technologies,Seed Funding,"4,75,000",nan,
1733,27/05/2016,Pianta,Consumer Internet,Online healthcare service discovery platform,Bangalore,"Kunal Shah, Sandeep Tandon",Seed Funding,N/A,nan,
1735,31/05/2016,Play Your Sport,Consumer Internet,Location based Sports & Fitness Discovery App,New Delhi,Ashish Gupta and other undisclosed investors,Seed Funding,N/A,nan,
1737,31/05/2016,CCavenue,Consumer Internet,Payment Gateway,Mumbai,NSI Infinium Global Pvt. Ltd,Private Equity,"89,00,000",nan,
1740,31/05/2016,MachaDalo,Consumer Internet,Hyperlocal Advertising Platform,Mumbai,Undisclosed Investors,Seed Funding,"1,75,000",nan,
1741,01/04/2016,Dil Mil,Consumer Internet,Matchmaking Mobile App,SFO / Bangalore,"Nelstone Ventures, Transmedia Capital, Maiden Lane Ventures, CSC Upshot & Angel investors",Private Equity,"27,00,000",nan,
1742,01/04/2016,PicsDream,Consumer Internet,Online Marketplace for Photographers,Delhi,Raman Roy,Seed Funding,N/A,nan,
1743,01/04/2016,Process 9,Consumer Internet,online translation and transliteration,Gurgaon,"Indian Angel Network, Alok Sharma, Kris Gopalakrishnan, Saurabh Srivastava, and Ajai Chowdhry",Seed Funding,N/A,nan,
1744,04/04/2016,Housing,Consumer Internet,Real Estate Portal,Mumbai,Vineet Singh,Private Equity,N/A,nan,
1746,04/04/2016,Hungama,Consumer Internet,Digital Media Entertainment Portal,Mumbai,Xiaomi Inc,Private Equity,"2,50,00,000",nan,
1747,04/04/2016,Highway Delite,Consumer Internet,Various Highway Help Services,Bangalore,N.S. Raghavan Centre for Entrepreneurial Learning,Seed Funding,N/A,nan,
1750,05/04/2016,Servify,Consumer Internet,Gadget & Appliances Service App,Mumbai,"Blume Ventures, Barkawi Holdings GmbH, TM Service Technology Holdings GmbH",Private Equity,N/A,nan,
1752,06/04/2016,gear6,Consumer Internet,Online bike service and repairs platform,Bangalore,Ninestarter,Seed Funding,"5,00,000",nan,
1753,06/04/2016,MyGlamm,Consumer Internet,Mobile based on-demand Beauty Services platform,Mumbai,L\\xe2\\x80\\x99Occitane,Private Equity,"60,00,000",nan,
1754,06/04/2016,Petoo,Consumer Internet,Online Food Delivery Platform,Bangalore,Axilor Ventures,Private Equity,"10,00,000",nan,
1755,07/04/2016,Truly Social,Consumer Internet,Mobile Gaming Studio,London,Nazara Technologies Pvt Ltd,Private Equity,N/A,nan,
1756,08/04/2016,Little Black Book,Consumer Internet,"Curated Food, event & Lifestyle guide",New Delhi,"IDG, Indian Angel Network",Seed Funding,N/A,nan,
1758,08/04/2016,imedilane,Consumer Internet,Online Health Diagnosis platform,New Delhi,"Mahendra Patel, Nilender Chauhan",Seed Funding,40000,nan,
1759,11/04/2016,Living Local,Consumer Internet,Social discovery platform,Mumbai,Rattan Chadha,Seed Funding,"2,00,000",nan,
1761,11/04/2016,Oyo,Consumer Internet,Online Branded Budget Room Booking Service,New Delhi,"Softbank, Sequoia Capital, Lightspeed Venture Partners, Greenoaks Capital, DSG Consumer Partners and Venture Nursery",Private Equity,"10,00,00,000",nan,
1762,11/04/2016,PriceRaja,Consumer Internet,Price Comparison Portal,Gurgaon,Prashant Puri,Seed Funding,"3,00,000",nan,
1763,12/04/2016,MagicX,Consumer Internet,On-Demand Task Management App,Bangalore,"Kris Gopalakrishnan, Dr. Ranjan Pai",Seed Funding,"10,00,000",nan,
1764,12/04/2016,Happydemic,Consumer Internet,Artist Discovery & Booking platform,Mumbai,Shaan,Seed Funding,N/A,nan,
1766,12/04/2016,Indi.com,Consumer Internet,Video Social Network,N/A,Anil Kapoor,Seed Funding,N/A,nan,
1767,13/04/2016,Legalraasta,Consumer Internet,Online legal Services for Startups,New Delhi,"Pravin Khandelwal, Yatin Kumar Jain",Seed Funding,"10,00,000",nan,
1768,13/04/2016,RainCan,Consumer Internet,Subscription-based grocery delivery Mobile App,Pune,Dr. Aniruddha Malpani,Seed Funding,"1,50,000",nan,
1771,14/04/2016,Wedwise,Consumer Internet,Wedding related services community,New Delhi,StartUp Equity Partners,Seed Funding,N/A,nan,
1773,15/04/2016,Deal 4Loans,Consumer Internet,Loan Comparison Portal,Noida,"Ram Shriram, Neeraj Arora, Puru Vashishtha",Seed Funding,N/A,nan,
1774,15/04/2016,RenewBuy,Consumer Internet,Online Car & Bike Insurance Comparison portal,New Delhi,Mount Nathan Advisors,Seed Funding,"10,00,000",nan,
1775,15/04/2016,Blue Box Media,Consumer Internet,Online Tech Portals,Jaipur,"Mahavir Pratap Sharma, Ajay Data, Yogesh Chaudhary, Sanjay Phophaliya, Siddharth Agarwal, Kamal Kothari",Seed Funding,N/A,nan,
1776,15/04/2016,Vyomo,Consumer Internet,On-Demand Beauty Service provider,New Delhi,Naturals Salon Chain,Private Equity,"1,50,00,000",nan,
1778,15/04/2016,MInd Your Fleet,Consumer Internet,Car Rental Software,Noida,Undisclosed Investors,Seed Funding,N/A,nan,
1779,15/04/2016,NestAway,Consumer Internet,Furnished Home Rental Platform,Bangalore,Tiger Global,Private Equity,"3,00,00,000",nan,
1780,15/04/2016,Tapchief,Consumer Internet,Expert Advice Platform,Bangalore,Vijay Shekhar Sharma,Seed Funding,"1,50,000",nan,
1781,18/04/2016,Rapido,Consumer Internet,Bike Aggregator App,Bangalore,"Pawan Munjal, AdvantEdge Partners, Astarc Ventures",Private Equity,N/A,nan,
1784,18/04/2016,Houssup,Consumer Internet,interior design and home furnishing portal,Jaipur,"Mitin Patel, Gaurav Agarwal",Seed Funding,N/A,nan,
1785,18/04/2016,Jugnoo,Consumer Internet,On-demand Delivery & Logistics platform,Chandigarh,Paytm & existing investors,Private Equity,"1,00,00,000",nan,
1788,19/04/2016,DriversCart,Consumer Internet,on-demand chauffeur provider,Chennai,ah! Ventures,Seed Funding,"4,50,000",nan,
1790,19/04/2016,CollegeDekho,Consumer Internet,College & Student information platform,New Delhi,Man Capital,Private Equity,"20,00,000",nan,
1791,19/04/2016,OYOfit,Consumer Internet,Fitness Services Aggregator platform,Bangalore,RN Agarwal,Seed Funding,N/A,nan,
1792,19/04/2016,Oliveboard,Consumer Internet,Online exam practice & preparation platform,Bangalore,India Educational Investment Fund,Private Equity,N/A,nan,
1793,19/04/2016,Simplilearn,Consumer Internet,Online certification platform,Bangalore,Brand Capital,Private Equity,N/A,nan,
1795,20/04/2016,Fashalot,Consumer Internet,Fashion and Store discovery mobile app,New Delhi,"YourNest Angel Fund, Rajul Garg",Seed Funding,N/A,nan,
1796,20/04/2016,Broomberg,Consumer Internet,Cleaning Services Provider,New Delhi,Undisclosed Angel investors & HNIs,Seed Funding,N/A,nan,
1797,21/04/2016,m.paani,Consumer Internet,Loyalty rewards platform,Mumbai,"Blume Ventures, Adil Allana, Aprameya Radhakrishna, Gautam Ivatury, Signal Point Partners",Seed Funding,N/A,nan,
1799,21/04/2016,mishTag,Consumer Internet,"Style, Fashion Discovery Mobile app",New Delhi,"M&Y Partners, SVG Media, Anthil Ventures & others",Seed Funding,N/A,nan,
1802,22/04/2016,Knolskae,Consumer Internet,Educational Gamification & Simulation platform,Bangalore,"Inventus Capital Partners, HR Fund",Private Equity,N/A,nan,
1804,22/04/2016,TOKO Innovation Studios,Consumer Internet,Children\xe2\x80\x99s Entertainment Games & Products,New Delhi,Indian Angel network,Seed Funding,"4,50,000",nan,
1805,25/04/2016,Commut,Consumer Internet,Shuttle Service Provider,Hyderabad,50K Ventures,Seed Funding,"2,00,000",nan,
1806,25/04/2016,intouchapp,Consumer Internet,Contact Management Mobile App,Pune,Blume Ventures,Seed Funding,N/A,nan,
1808,26/04/2016,Transerv,Consumer Internet,Digital Payments platform,Mumbai,"IDFC SPICE Fund, Micromax Informatics",Private Equity,"1,50,00,000",nan,
1809,26/04/2016,ClearTax,Consumer Internet,Online filing of Tax returns,Bangalore,"Max Levchin, Scott Banister",Private Equity,"13,00,000",nan,
1811,27/04/2016,MilkBasket,Consumer Internet,Micro Grocery Delivery Platform,Gurgaon,EVC Ventures,Seed Funding,"5,00,000",nan,
1812,27/04/2016,CareonGO,Consumer Internet,Online Pharmacy,,"Farooq Oomerbhoy, Anupam Mittal, Anand Mittal, Ravi Garikipati, Vibhu Garg, Singapore Angel Network, Konglo Ventures",Seed Funding,N/A,nan,
1813,27/04/2016,RailYatri,Consumer Internet,Train Related Information portal,Noida,"Nandan Nilekani, Helion Ventures, Omidyar Networks, Blume Ventures",Private Equity,N/A,nan,
1814,27/04/2016,ICHR,Consumer Internet,Mobile based Children health Information app,New Delhi,Undisclosed,Seed Funding,"4,50,000",nan,
1815,27/04/2016,Murgency,Consumer Internet,Medical Emergency Response App,Mumbai,Axilor Ventures,Private Equity,N/A,nan,
1816,28/04/2016,The Wedding Brigade,Consumer Internet,Online Wedding Information Portal,Mumbai,Blume Ventures & Other unnamed Investors,Seed Funding,"6,00,000",nan,
1817,28/04/2016,DocsApp,Consumer Internet,Online Doctor Discovery & Chat platform,Bangalore,"Rebright Partners, Anand Rajaraman, Venky Harinarayan",Private Equity,"12,00,000",nan,
1818,29/04/2016,Impact Guru,Consumer Internet,Online Crowdfunding platform for NGOs & Social Projects,Mumbai,"RB Investments, Fundnel",Seed Funding,"5,00,000",nan,
1820,01/03/2016,DriveU,Consumer Internet,Chauffeurs Discovery for private car owners,Bangalore,Unitus Seed Fund,Seed Funding,N/A,nan,
1821,01/03/2016,Gympik,Consumer Internet,"Fitness Centres, Gym Discovery online marketplace",Bangalore,RoundGlass Partners,Private Equity,N/A,nan,
1822,01/03/2016,Testbook,Consumer Internet,Online Test Preparation Platform,Mumbai,S Chand & Co,Private Equity,N/A,nan,
1824,02/03/2016,MoMark,Consumer Internet,Mobile Wallet Aggregation platform,Noida,YourNest Angel Fund,Private Equity,"6,00,000",nan,
1825,02/03/2016,Skedool,Consumer Internet,AI based Office Assistant Mobile App,Seattle / Bangalore,"Kludein LLC\nPhanindra Sama, Narayan Ramachandran, Pranav Pai",Seed Funding,N/A,nan,
1829,03/03/2016,Shouut,Consumer Internet,Social Discovery Mobile app,New Delhi,Undisclosed investor,Seed Funding,"5,00,000",nan,
1830,04/03/2016,TinyStep,Consumer Internet,Parenting Social Network Platform,Bangalore,Matt Glickman,Private Equity,N/A,nan,
1833,04/03/2016,FTCash,Consumer Internet,Mobile Payments Platform,Kolkata,IvyCap Ventures,Seed Funding,"1,50,000",nan,
1834,04/03/2016,Civilsdaily,Consumer Internet,Civil Services News Aggregator,New Delhi,Manoj Kumar & Other undisclosed investors,Seed Funding,N/A,nan,
1835,04/03/2016,Zappka,Consumer Internet,Mobile App discovery and review platform,Gurgaon,"Daman Soni, Rajat Gupta & Others",Seed Funding,"1,00,000",nan,
1838,07/03/2016,N.O.W,Consumer Internet,Bike Taxi Service & Hyperlocal Delivery App,Noida,"Ruchirans Jaipuria, Anuj Sanghi",Seed Funding,"5,00,000",nan,
1840,07/03/2016,Reach,Consumer Internet,Cross Platform P2P file sharing mobile app,Bangalore,"Rebright Partners, Sol Primero, Sudhir Anandarao, Ankur Warikoo, Ankur Singla",Seed Funding,"5,00,000",nan,
1841,07/03/2016,Vanity Cube,Consumer Internet,Hyperlocal Beauty Services platform,New Delhi,Unicorn Ventures,Seed Funding,"2,50,000",nan,
1843,07/03/2016,Medidaili,Consumer Internet,Medical Support service platform,Bangalore,Undisclosed private investors,Seed Funding,"1,00,000",nan,
1845,08/03/2016,Cookaroo,Consumer Internet,Food Delivery Platform,Bangalore,Vijay Krishna Yadav,Seed Funding,N/A,nan,
1847,08/03/2016,LoveCycles,Consumer Internet,Women\\xe2\\x80\\x99s health Tracker,Bangalore,Prime Venture Partners,Seed Funding,"7,50,000",nan,
1849,08/03/2016,dunzo,Consumer Internet,Daily Task Management App,Bangalore,"Aspada Investment Advisors, Blume Ventures.",Seed Funding,"6,50,000",nan,
1853,09/03/2016,Nukkad Shops,Consumer Internet,Hyperlocal Grocery Delivery Service,Hyderabad,PurpleTalk Inc,Seed Funding,"10,00,000",nan,
1854,09/03/2016,Cloudacar,Consumer Internet,Carpooling Mobile App,Pune,"Amit Choudhary, Anuj Puri",Seed Funding,N/A,nan,
1855,09/03/2016,Justride,Consumer Internet,Self Drive Car Rental,Mumbai,Dheeraj Jain & Other angel investors,Seed Funding,"4,00,000",nan,
1856,09/03/2016,Yana,Consumer Internet,Personal AI Transaction Engine App,Gurgaon,"Puneet Gupta,",Seed Funding,N/A,nan,
1864,14/03/2016,eSwasthya,Consumer Internet,Online Medicine Delivery Aggregator,Ahmedabad,Hemang Sahani,Seed Funding,N/A,nan,
1865,15/03/2016,FlipClass,Consumer Internet,Tutor Search Platform,Bangalore,"S Chand and Co Pvt Ltd, Blume Ventures",Private Equity,"10,00,000",nan,
1867,15/03/2016,WithMe,Consumer Internet,Personalized Fashion App,Gurgaon,"Alex Kuruvilla, Pradeep Guha, Saket Dhankar, Rajan Pandhare",Seed Funding,"2,50,000",nan,
1868,16/03/2016,Gapoon,Consumer Internet,Hyperlocal Home Maintenance services,Bangalore,"Chandrashekar Tallapragada, Pankaj Kapoor",Seed Funding,"1,80,000",nan,
1869,16/03/2016,Avagmah,Consumer Internet,Online Education Portal,Bangalore,"Kris Gopalakrishnan, Atul Nishar",Seed Funding,N/A,nan,
1870,16/03/2016,WorkIndia,Consumer Internet,Online Job Board,Mumbai,Beenext,Seed Funding,N/A,nan,
1871,16/03/2016,Wealthy,Consumer Internet,Online Investment management portal,Bangalore,"Zishaan Hayath, Abhishek Goyal, Arjun and Rohan Malhotra, Harpreet Singh Grover, Gagan Dugal",Seed Funding,"2,50,000",nan,
1873,17/03/2016,Qlivery,Consumer Internet,Ondemand Concierge Service,Gurgaon,Swastika Company Ltd,Seed Funding,"2,30,000",nan,
1874,17/03/2016,HealthEnablr,Consumer Internet,Doctor Discovery and booking platform,Mumbai,Undisclosed investors,Seed Funding,"8,00,000",nan,
1875,17/03/2016,Liftiee,Consumer Internet,Car/ bike Pooling App,Mumbai,"Rannvijay Singh, Anita Hassanandani",Seed Funding,"1,08,000",nan,
1877,19/03/2016,goSporto,Consumer Internet,Online Sports discovery and booking platform,New Delhi,Naveen Gupta,Seed Funding,30000,nan,
1878,21/03/2016,OneClickWash,Consumer Internet,Online Laundry & Washing service Booking & Delivery,Gurgaon,Unitus Seed Fund,Seed Funding,N/A,nan,
1879,21/03/2016,Girnar Software,Consumer Internet,Online News Media Network,Jaipur,Google Capital,Private Equity,N/A,nan,
1880,21/03/2016,Room On Call,Consumer Internet,Budget hotel aggregator,Gurgaon,CASHurDRIVE Marketing Pvt Ltd,Private Equity,"20,00,000",nan,
1881,22/03/2016,Byju\\xe2\\x80\\x99s,Consumer Internet,Educational Video Content Creator,Bangalore,"Sequoia India, Sofina",Private Equity,"7,50,00,000",nan,
1883,22/03/2016,DrivoJoy,Consumer Internet,On-demand 2-wheeler Servicing platform,Bangalore,"Indian Angel Network, Tracxn Labs & Others",Seed Funding,"6,00,000",nan,
1885,22/03/2016,LifCare,Consumer Internet,Online Pharmacy portal,Jaipur,"Rajul Garg, Alok Mittal, Kunal Shah, Rishi Mandawat, Dheeraj Jain, Sandeep Tandon, Dexter Angel Circle",Seed Funding,N/A,nan,
1886,22/03/2016,CreditSeva,Consumer Internet,Online Credit management tools,Hyderabad,"Pix Vine Capital, Infocomm Development Authority of Singapore",Seed Funding,"3,60,000",nan,
1887,22/03/2016,CityShor,Consumer Internet,online lifestyle media recommendation portal,Ahmedabad,GAIN,Seed Funding,N/A,nan,
1891,23/03/2016,eKincare,Consumer Internet,Healthcare related solutions,Hyderabad,"BitChemy Ventures, Maheshwari Investments Pvt Ltd, Anshoo Gaur, Rama Krishna Reddy, Sandeep Seerapu",Private Equity,"3,30,000",nan,
1892,23/03/2016,HashLearn,Consumer Internet,Mobile based private tutoring services,,"Bhavish Aggarwal, Binny Bansal,\xc2\xa0 Rajan Anandan, Mekin Maheshwar, Sunil Kalra, Anupam Mittal, Krishna Mehra, Singapore Angel Network",Seed Funding,N/A,nan,
1893,23/03/2016,Wheelstreet,Consumer Internet,Online Bike Rental platform,Bangalore,Broadbean Capital services,Private Equity,"5,00,000",nan,
1894,24/03/2016,Horntell,Consumer Internet,Unified Push Notification service,Gurgaon,"Bharanidharan Viswanathan, Sanjiv Mittal, Shobhit Shukla, Rahul Agarwal",Seed Funding,"1,50,000",nan,
1896,29/03/2016,HealthEminds,Consumer Internet,Online mental healthcare,Bangalore,Robin Utthappa,Seed Funding,N/A,nan,
1897,29/03/2016,Babygogo,Consumer Internet,Child healthcare experts aggregator mobile app,New Delhi,"Rajul Garg, Daljit Singh, Aditya Vij, Kishore Kumar, Shuchin Bajaj",Seed Funding,"3,00,000",nan,
1899,29/03/2016,QikShip,Consumer Internet,Mobile based Logistics provider,New Delhi,undisclosed investors,Seed Funding,"2,00,000",nan,
1900,29/03/2016,FixNix,Consumer Internet,GRC SAAS Platform,Chennai,Jay Vijayan,Seed Funding,"5,00,000",nan,
1903,31/03/2016,SwitchMe,Consumer Internet,Home Loan Rate comparison platform,Mumbai,"Mohandas Pai, Hiro Mashita, Singapore Angel Network, 500 Startups, Rajan Anandan, Ajay Sarupria",Seed Funding,N/A,nan,
1907,02/02/2016,Oust App,Consumer Internet,Competitive Exam Preparation Platform,Bangalore,"T V Mohandas Pai,\xc2\xa0 Aarin Capital",Seed Funding,N/A,nan,
1908,02/02/2016,Strike,Consumer Internet,Mobile Email productivity tool,Bangalore,Multiple investors through Ten Minute Million competition,Seed Funding,22500,nan,
1909,02/02/2016,MaaxMarket,Consumer Internet,Marketing Automation platform,N/A,Multiple investors through Ten Minute Million competition,Seed Funding,22500,nan,
1912,03/02/2016,Mazkara,Consumer Internet,Beauty & Wellness Platform,Pune / Dubai,Dunamis Ventures Pte Ltd.,Seed Funding,"10,00,000",nan,
1914,03/02/2016,Pindropmusic,Consumer Internet,Music Discovery Mobile App,Noida,Green House Ventures (GHV),Seed Funding,"1,00,000",nan,
1915,03/02/2016,Woodpie,Consumer Internet,Book Recommendation Service,Bangalore,Ingram Content Group,Seed Funding,30000,nan,
1920,05/02/2016,Turtlemint,Consumer Internet,online personalized insurance platform,Mumbai,Nexus Venture Partners,Private Equity,N/A,nan,
1923,05/02/2016,American Vision,Consumer Internet,Optical Store Aggregator Platform,Pune,Undisclosed investors,Seed Funding,81000,nan,
1924,05/02/2016,DawaiLelo,Consumer Internet,Healthcare Services & Online Pharmacy Mobile App,Varanasi,Undisclosed investors,Seed Funding,52000,nan,
1928,08/02/2016,iStyleYou,Consumer Internet,Personal Fashion Stylist App,Gurgaon,Green House Ventures (GHV),Seed Funding,"1,00,000",nan,
1929,08/02/2016,AdUrCup,Consumer Internet,Ad Network,New Delhi,Green House Ventures (GHV),Seed Funding,"1,00,000",nan,
1930,08/02/2016,Weddingz,Consumer Internet,online marketplace for wedding venues and vendors,Mumbai,Sixth Sense Ventures,Private Equity,N/A,nan,
1931,08/02/2016,Urban Dhobi,Consumer Internet,On Demand Laundry Services,Jaipur,"Vinod Bansal, Sanjeev Singhal",Seed Funding,N/A,nan,
1932,08/02/2016,Gray Routes,Consumer Internet,Last mile logistics solutions,Mumbai,"Mahesh Parasuraman, Rahul Gautam & Others",Seed Funding,N/A,nan,
1936,09/02/2016,Inc42,Consumer Internet,Startup Focused Media News Portal,New Delhi,"India Ventures, Aarin Capital & Others",Seed Funding,N/A,nan,
1938,10/02/2016,Capzest,Consumer Internet,Digital Lending Platform,Mumbai,Lion Ventures,Seed Funding,"2,00,000",nan,
1939,10/02/2016,GlamStudios,Consumer Internet,Online Salon Aggregator,Noida,Aqeel Ahmed,Seed Funding,N/A,nan,
1940,10/02/2016,Affimity,Consumer Internet,Social Networking platform,Bangalore,undisclosed investors,Seed Funding,"12,00,000",nan,
1943,10/02/2016,Shopkirana,Consumer Internet,Retailer Supply Chain platform,Indore,"Atul Jain, Anil Gelra, Jaikumar Nair",Seed Funding,N/A,nan,
1944,10/02/2016,Stylofie,Consumer Internet,Online Beauty Parlour search & discovery Platform,Gurgaon,Jaideep Mehta,Seed Funding,N/A,nan,
1949,12/02/2016,RKSV,Consumer Internet,Online Stock Trading Platform,Mumbai,Kalaari Capital,Private Equity,"40,00,000",nan,
1950,15/02/2016,Aasaanjobs,Consumer Internet,Online Recruitment Marketplace,Mumbai,"Aspada Advisors, IDG Ventures,\xc2\xa0 Inventus Capital",Private Equity,"50,00,000",nan,
1952,15/02/2016,Jugnoo,Consumer Internet,Transportation & On-demand delivery aggregator,Chandigarh,Saumya Tandon,Private Equity,N/A,nan,
1954,15/02/2016,GoYaNo,Consumer Internet,Events & Restaurant Discovery Marketplace App,Gurgaon,Mukesh Kumar Gupta,Seed Funding,50000,nan,
1955,15/02/2016,RentSher,Consumer Internet,Online Household Product Rental platform,Bangalore,"Vaibhav Doshi, Abhay Singhal, Vibhu Garg, Joby Babu, Abhishek Acharya, Manish Shah",Seed Funding,"3,00,000",nan,
1957,15/02/2016,Legistify,Consumer Internet,Online Legal services platform,New Delhi,Ranjit Singh,Seed Funding,N/A,nan,
1958,16/02/2016,TableHero,Consumer Internet,Dynamic Restaurant Website creator,Bangalore,"GrowX Ventures, Kunal Shah, Sandeep Tandon, Haresh Chawla, Powai Lake Ventures, Globevestor",Seed Funding,"10,00,000",nan,
1962,16/02/2016,Tring,Consumer Internet,Instant Messaging App,Pune,Vishwadeep Bajaj & Others,Seed Funding,N/A,nan,
1963,16/02/2016,Medinfi,Consumer Internet,Doctor & Clinics Discovery platform,Bangalore,"Rajnish Sinha, Prijit Debnath, Kanchan Ghoshal",Seed Funding,N/A,nan,
1964,17/02/2016,Timemytask,Consumer Internet,On-Demand home cleaning services,Mumbai,Lead Angels,Seed Funding,N/A,nan,
1966,17/02/2016,Notary Mama,Consumer Internet,On-demand Legal documentation and registration service,Bangalore,"Dr Nandish Domlur, Amit Sandill",Seed Funding,N/A,nan,
1967,17/02/2016,The Viral Fever,Consumer Internet,Independent Online Video production company,Mumbai,Tiger Global,Private Equity,"1,00,00,000",nan,
1970,18/02/2016,GetVee,Consumer Internet,Matrimony & Couples only mobile platform,New Delhi,"Lightspeed Venture Partners, K Ganesh",Private Equity,N/A,nan,
1971,18/02/2016,HealthKumbh,Consumer Internet,Health related Information portal,Ahmedabad,Undisclosed investor,Seed Funding,73000,nan,
1972,18/02/2016,Unlaze,Consumer Internet,Social Networking app for outdoor interests,Gurgaon,"Sujal Shah, Dino Morea",Seed Funding,N/A,nan,
